{
  "question": "What is the average order value per customer email for acme_example?",
  "time_range": "2024-01-01_to_2024-01-31",
  "entity": "customer_order_value_by_email",
  "segment": "all_customers",
  "actor": "analyst_acme_example",
  "purpose": "customer_segmentation_analysis",
  "supported_decision": "marketing_targeting"
}
